[I 2026-05-19 14:16:17,674] Trial 43 finished with value: 0.22855860792402238 and parameters: {'HALF_LIFE_WEEKS': 7.103356888881011, 'SHRINK_K': 4.012029807841271, 'CN_PRIOR': -5.228261297682176, 'CN_INTL_K': 36.110929574843674, 'CN_INDIRECT_WEIGHT': 0.4761054067072116, 'REGION_SPILLOVER_ALPHA': 0.3644103033883495, 'CHAMPIONS_MULT': 1.498700259624377, 'INTL_WIN_MULT': 0.8108319949257636, 'ROSTER_PERSISTENCE': 0.6168039054269795, 'MARGIN_FN': 'tanh4'}. Best is trial 2 with value: 0.2283650706302642.
[I 2026-05-19 14:16:21,405] Trial 44 finished with value: 0.23774848148155708 and parameters: {'HALF_LIFE_WEEKS': 7.924915631301727, 'SHRINK_K': 4.295408364396711, 'CN_PRIOR': -5.282950278628431, 'CN_INTL_K': 24.06189635323057, 'CN_INDIRECT_WEIGHT': 0.40321617715690916, 'REGION_SPILLOVER_ALPHA': 0.28561013382704786, 'CHAMPIONS_MULT': 1.4005389915410058, 'INTL_WIN_MULT': 0.9862277326633533, 'ROSTER_PERSISTENCE': 0.6847613218716241, 'MARGIN_FN': 'tanh4'}. Best is trial 2 with value: 0.2283650706302642.
[I 2026-05-19 14:16:25,096] Trial 45 finished with value: 0.2389545515604278 and parameters: {'HALF_LIFE_WEEKS': 6.533152274769581, 'SHRINK_K': 2.994202673416938, 'CN_PRIOR': -5.923592610708289, 'CN_INTL_K': 32.3989043562048, 'CN_INDIRECT_WEIGHT': 0.17653277782354765, 'REGION_SPILLOVER_ALPHA': 0.36790481310425327, 'CHAMPIONS_MULT': 1.49514424181528, 'INTL_WIN_MULT': 0.8083682017757962, 'ROSTER_PERSISTENCE': 0.6237751066565869, 'MARGIN_FN': 'tanh4'}. Best is trial 2 with value: 0.2283650706302642.
[I 2026-05-19 14:16:28,795] Trial 46 finished with value: 0.24015003631421966 and parameters: {'HALF_LIFE_WEEKS': 7.040431692976487, 'SHRINK_K': 13.383159229041215, 'CN_PRIOR': -5.473405764720467, 'CN_INTL_K': 40.23117170007244, 'CN_INDIRECT_WEIGHT': 0.4665818083274769, 'REGION_SPILLOVER_ALPHA': 0.1420598530586729, 'CHAMPIONS_MULT': 1.328971738404857, 'INTL_WIN_MULT': 0.9845310598284582, 'ROSTER_PERSISTENCE': 0.6601306298232633, 'MARGIN_FN': 'log1p'}. Best is trial 2 with value: 0.2283650706302642.
[I 2026-05-19 14:16:32,522] Trial 47 finished with value: 0.23784666334160867 and parameters: {'HALF_LIFE_WEEKS': 7.577022245196348, 'SHRINK_K': 3.4176472556893795, 'CN_PRIOR': -4.652832030353811, 'CN_INTL_K': 36.96570939365611, 'CN_INDIRECT_WEIGHT': 0.6321562010092229, 'REGION_SPILLOVER_ALPHA': 0.005005122309666599, 'CHAMPIONS_MULT': 1.7598060646650704, 'INTL_WIN_MULT': 0.8363591648400314, 'ROSTER_PERSISTENCE': 0.7339986589737788, 'MARGIN_FN': 'tanh4'}. Best is trial 2 with value: 0.2283650706302642.
[I 2026-05-19 14:16:35,868] Trial 48 finished with value: 0.23805493503433792 and parameters: {'HALF_LIFE_WEEKS': 8.871007000084624, 'SHRINK_K': 11.420792172450502, 'CN_PRIOR': -3.1237329096055744, 'CN_INTL_K': 28.206519356143176, 'CN_INDIRECT_WEIGHT': 0.34218415160126686, 'REGION_SPILLOVER_ALPHA': 0.33976757602345753, 'CHAMPIONS_MULT': 1.2823587773088092, 'INTL_WIN_MULT': 0.9039542382880394, 'ROSTER_PERSISTENCE': 0.5893624533294118, 'MARGIN_FN': 'tanh4'}. Best is trial 2 with value: 0.2283650706302642.
[I 2026-05-19 14:16:39,405] Trial 49 finished with value: 0.2378676014405701 and parameters: {'HALF_LIFE_WEEKS': 6.310206534603123, 'SHRINK_K': 4.301328099551863, 'CN_PRIOR': -5.324115834581741, 'CN_INTL_K': 26.000681624505134, 'CN_INDIRECT_WEIGHT': 0.39411742558711566, 'REGION_SPILLOVER_ALPHA': 0.22204614386207178, 'CHAMPIONS_MULT': 1.5386156969356175, 'INTL_WIN_MULT': 0.9095294639939331, 'ROSTER_PERSISTENCE': 0.8419729384330609, 'MARGIN_FN': 'tanh4'}. Best is trial 2 with value: 0.2283650706302642.
[I 2026-05-19 14:16:42,743] Trial 50 finished with value: 0.22816660595829996 and parameters: {'HALF_LIFE_WEEKS': 5.711289397894727, 'SHRINK_K': 6.488390360757833, 'CN_PRIOR': -5.654537143781709, 'CN_INTL_K': 30.65369589109802, 'CN_INDIRECT_WEIGHT': 0.2764282806533598, 'REGION_SPILLOVER_ALPHA': 0.44824741975226684, 'CHAMPIONS_MULT': 1.6409917619461258, 'INTL_WIN_MULT': 1.0768874005519435, 'ROSTER_PERSISTENCE': 0.7053530559034402, 'MARGIN_FN': 'tanh4'}. Best is trial 50 with value: 0.22816660595829996.
[I 2026-05-19 14:16:46,142] Trial 51 finished with value: 0.22795448423875309 and parameters: {'HALF_LIFE_WEEKS': 5.8311047080112015, 'SHRINK_K': 5.692535739187274, 'CN_PRIOR': -5.722269633253338, 'CN_INTL_K': 30.249896086400827, 'CN_INDIRECT_WEIGHT': 0.2882287581452328, 'REGION_SPILLOVER_ALPHA': 0.4471012611260085, 'CHAMPIONS_MULT': 1.8571441552933163, 'INTL_WIN_MULT': 1.085520333855727, 'ROSTER_PERSISTENCE': 0.7149575416809066, 'MARGIN_FN': 'tanh4'}. Best is trial 51 with value: 0.22795448423875309.
[I 2026-05-19 14:16:49,570] Trial 52 finished with value: 0.23822405602438051 and parameters: {'HALF_LIFE_WEEKS': 5.298955433329553, 'SHRINK_K': 6.680432908686286, 'CN_PRIOR': -5.722631775133265, 'CN_INTL_K': 29.81907486639347, 'CN_INDIRECT_WEIGHT': 0.08893764667609022, 'REGION_SPILLOVER_ALPHA': 0.5683002630275784, 'CHAMPIONS_MULT': 1.8852049535300541, 'INTL_WIN_MULT': 1.089215063985029, 'ROSTER_PERSISTENCE': 0.711518278687785, 'MARGIN_FN': 'tanh4'}. Best is trial 51 with value: 0.22795448423875309.
[I 2026-05-19 14:16:53,023] Trial 53 finished with value: 0.2278953728561134 and parameters: {'HALF_LIFE_WEEKS': 5.824771146381691, 'SHRINK_K': 5.935208156073095, 'CN_PRIOR': -5.765812296000416, 'CN_INTL_K': 36.281933693037345, 'CN_INDIRECT_WEIGHT': 0.2369690702674532, 'REGION_SPILLOVER_ALPHA': 0.46838778241983053, 'CHAMPIONS_MULT': 1.63207605220397, 'INTL_WIN_MULT': 1.074120589419957, 'ROSTER_PERSISTENCE': 0.7677113255358254, 'MARGIN_FN': 'tanh4'}. Best is trial 53 with value: 0.2278953728561134.
[I 2026-05-19 14:16:56,378] Trial 54 finished with value: 0.2281577353371384 and parameters: {'HALF_LIFE_WEEKS': 4.607552673039017, 'SHRINK_K': 5.672832405074597, 'CN_PRIOR': -5.813570901315318, 'CN_INTL_K': 35.43706286247, 'CN_INDIRECT_WEIGHT': 0.27068959200511356, 'REGION_SPILLOVER_ALPHA': 0.4658747479532289, 'CHAMPIONS_MULT': 1.7127553349397477, 'INTL_WIN_MULT': 1.1512275092188666, 'ROSTER_PERSISTENCE': 0.7997373331111193, 'MARGIN_FN': 'tanh4'}. Best is trial 53 with value: 0.2278953728561134.
[I 2026-05-19 14:16:59,895] Trial 55 finished with value: 0.22982959046126722 and parameters: {'HALF_LIFE_WEEKS': 4.832872351341329, 'SHRINK_K': 7.8701680119023205, 'CN_PRIOR': -5.783074982393995, 'CN_INTL_K': 35.628638443279215, 'CN_INDIRECT_WEIGHT': 0.2848624001084566, 'REGION_SPILLOVER_ALPHA': 0.4856244213950752, 'CHAMPIONS_MULT': 1.7137620347795524, 'INTL_WIN_MULT': 1.1601443646154692, 'ROSTER_PERSISTENCE': 0.8009505744534979, 'MARGIN_FN': 'log1p'}. Best is trial 53 with value: 0.2278953728561134.
[I 2026-05-19 14:17:04,248] Trial 56 finished with value: 0.22820483623000956 and parameters: {'HALF_LIFE_WEEKS': 5.83683214390411, 'SHRINK_K': 5.864549715225798, 'CN_PRIOR': -5.715449092476945, 'CN_INTL_K': 33.83175724756899, 'CN_INDIRECT_WEIGHT': 0.23084421734685323, 'REGION_SPILLOVER_ALPHA': 0.4249581798532597, 'CHAMPIONS_MULT': 1.6698905713626708, 'INTL_WIN_MULT': 1.219113207192349, 'ROSTER_PERSISTENCE': 0.7765374538916389, 'MARGIN_FN': 'sqrt'}. Best is trial 53 with value: 0.2278953728561134.
[I 2026-05-19 14:17:08,051] Trial 57 finished with value: 0.22822359416541377 and parameters: {'HALF_LIFE_WEEKS': 5.761420732780505, 'SHRINK_K': 6.111405398357011, 'CN_PRIOR': -5.9778768666889395, 'CN_INTL_K': 40.004138226694536, 'CN_INDIRECT_WEIGHT': 0.23391396313992832, 'REGION_SPILLOVER_ALPHA': 0.4295231561274205, 'CHAMPIONS_MULT': 1.6515360765419176, 'INTL_WIN_MULT': 1.2401325775498713, 'ROSTER_PERSISTENCE': 0.7653929515246453, 'MARGIN_FN': 'sqrt'}. Best is trial 53 with value: 0.2278953728561134.
[I 2026-05-19 14:17:12,428] Trial 58 finished with value: 0.2282003239582174 and parameters: {'HALF_LIFE_WEEKS': 5.864279083779854, 'SHRINK_K': 5.99334104275874, 'CN_PRIOR': -5.9795231897196155, 'CN_INTL_K': 39.82876826765199, 'CN_INDIRECT_WEIGHT': 0.23478910387382623, 'REGION_SPILLOVER_ALPHA': 0.434971074000787, 'CHAMPIONS_MULT': 1.6695790534327362, 'INTL_WIN_MULT': 1.212250117169315, 'ROSTER_PERSISTENCE': 0.777908792111448, 'MARGIN_FN': 'sqrt'}. Best is trial 53 with value: 0.2278953728561134.
[I 2026-05-19 14:17:16,038] Trial 59 finished with value: 0.22825650595475983 and parameters: {'HALF_LIFE_WEEKS': 4.695313380480603, 'SHRINK_K': 5.792698189688118, 'CN_PRIOR': -5.690096303244727, 'CN_INTL_K': 44.92118953892446, 'CN_INDIRECT_WEIGHT': 0.28546583932105235, 'REGION_SPILLOVER_ALPHA': 0.5578220858084412, 'CHAMPIONS_MULT': 1.9106216055544167, 'INTL_WIN_MULT': 1.2058876931033702, 'ROSTER_PERSISTENCE': 0.8428216201284034, 'MARGIN_FN': 'sqrt'}. Best is trial 53 with value: 0.2278953728561134.
[I 2026-05-19 14:17:19,698] Trial 60 finished with value: 0.228288897440747 and parameters: {'HALF_LIFE_WEEKS': 4.288792689331453, 'SHRINK_K': 6.518379177086265, 'CN_PRIOR': -5.415236311244679, 'CN_INTL_K': 30.966033103476285, 'CN_INDIRECT_WEIGHT': 0.20283735452871302, 'REGION_SPILLOVER_ALPHA': 0.666632709737685, 'CHAMPIONS_MULT': 2.0168035172707404, 'INTL_WIN_MULT': 1.0750001465698957, 'ROSTER_PERSISTENCE': 0.8164139485516838, 'MARGIN_FN': 'sqrt'}. Best is trial 53 with value: 0.2278953728561134.
[I 2026-05-19 14:17:23,164] Trial 61 finished with value: 0.22821311838774203 and parameters: {'HALF_LIFE_WEEKS': 5.811357730285515, 'SHRINK_K': 5.982109398682426, 'CN_PRIOR': -5.980045626708539, 'CN_INTL_K': 39.815125806994196, 'CN_INDIRECT_WEIGHT': 0.24247406982362296, 'REGION_SPILLOVER_ALPHA': 0.43533610990811994, 'CHAMPIONS_MULT': 1.6385944570092528, 'INTL_WIN_MULT': 1.242002763923412, 'ROSTER_PERSISTENCE': 0.7754768275967202, 'MARGIN_FN': 'sqrt'}. Best is trial 53 with value: 0.2278953728561134.
[I 2026-05-19 14:17:27,107] Trial 62 finished with value: 0.22817634624719788 and parameters: {'HALF_LIFE_WEEKS': 5.4626941415751284, 'SHRINK_K': 6.793766125431518, 'CN_PRIOR': -5.765013917745513, 'CN_INTL_K': 39.74448078165094, 'CN_INDIRECT_WEIGHT': 0.23548497740144025, 'REGION_SPILLOVER_ALPHA': 0.46297283096847963, 'CHAMPIONS_MULT': 1.6628085785404065, 'INTL_WIN_MULT': 1.289274595050865, 'ROSTER_PERSISTENCE': 0.7387641836039872, 'MARGIN_FN': 'sqrt'}. Best is trial 53 with value: 0.2278953728561134.
[I 2026-05-19 14:17:30,588] Trial 63 finished with value: 0.2281852080620964 and parameters: {'HALF_LIFE_WEEKS': 5.392149613845027, 'SHRINK_K': 6.69591735886836, 'CN_PRIOR': -5.788527136570321, 'CN_INTL_K': 33.84190987617083, 'CN_INDIRECT_WEIGHT': 0.27401315582669844, 'REGION_SPILLOVER_ALPHA': 0.4928042180351408, 'CHAMPIONS_MULT': 1.828852157413743, 'INTL_WIN_MULT': 1.293681242768994, 'ROSTER_PERSISTENCE': 0.7322741910768851, 'MARGIN_FN': 'sqrt'}. Best is trial 53 with value: 0.2278953728561134.
[I 2026-05-19 14:17:33,884] Trial 64 finished with value: 0.22818890331498318 and parameters: {'HALF_LIFE_WEEKS': 5.41391962194158, 'SHRINK_K': 7.72372862466454, 'CN_PRIOR': -5.83425549245023, 'CN_INTL_K': 42.27484429653617, 'CN_INDIRECT_WEIGHT': 0.2642981352739531, 'REGION_SPILLOVER_ALPHA': 0.4765701631500374, 'CHAMPIONS_MULT': 1.830660229693226, 'INTL_WIN_MULT': 1.1456545659929036, 'ROSTER_PERSISTENCE': 0.739353429532744, 'MARGIN_FN': 'sqrt'}. Best is trial 53 with value: 0.2278953728561134.
[I 2026-05-19 14:17:37,235] Trial 65 finished with value: 0.22818970452982054 and parameters: {'HALF_LIFE_WEEKS': 5.434452363581612, 'SHRINK_K': 7.809008966701347, 'CN_PRIOR': -5.7979137174505775, 'CN_INTL_K': 43.0175308644384, 'CN_INDIRECT_WEIGHT': 0.2799813924498374, 'REGION_SPILLOVER_ALPHA': 0.5459499147840645, 'CHAMPIONS_MULT': 1.8348329906597203, 'INTL_WIN_MULT': 1.319397095609653, 'ROSTER_PERSISTENCE': 0.7358927253071322, 'MARGIN_FN': 'sqrt'}. Best is trial 53 with value: 0.2278953728561134.
[I 2026-05-19 14:17:40,519] Trial 66 finished with value: 0.22828698406591996 and parameters: {'HALF_LIFE_WEEKS': 5.000518534850872, 'SHRINK_K': 6.766157076786036, 'CN_PRIOR': -5.564097021715177, 'CN_INTL_K': 37.72942433317099, 'CN_INDIRECT_WEIGHT': 0.20220028988059593, 'REGION_SPILLOVER_ALPHA': 0.6156490559545164, 'CHAMPIONS_MULT': 2.005100449493969, 'INTL_WIN_MULT': 1.148431259004672, 'ROSTER_PERSISTENCE': 0.7393865936941665, 'MARGIN_FN': 'sqrt'}. Best is trial 53 with value: 0.2278953728561134.
[I 2026-05-19 14:17:43,807] Trial 67 finished with value: 0.23954869794837114 and parameters: {'HALF_LIFE_WEEKS': 3.76469095808341, 'SHRINK_K': 7.556786691637197, 'CN_PRIOR': -5.387015993131496, 'CN_INTL_K': 41.6362185769064, 'CN_INDIRECT_WEIGHT': 0.2641589981249546, 'REGION_SPILLOVER_ALPHA': 0.4833929583815481, 'CHAMPIONS_MULT': 1.7821797083718935, 'INTL_WIN_MULT': 1.292652299149069, 'ROSTER_PERSISTENCE': 0.7097627894486498, 'MARGIN_FN': 'sqrt'}. Best is trial 53 with value: 0.2278953728561134.
[I 2026-05-19 14:17:47,141] Trial 68 finished with value: 0.2282243793463937 and parameters: {'HALF_LIFE_WEEKS': 4.512108451989292, 'SHRINK_K': 8.242630489426004, 'CN_PRIOR': -5.864998259777792, 'CN_INTL_K': 46.50082299106951, 'CN_INDIRECT_WEIGHT': 0.3310555133296773, 'REGION_SPILLOVER_ALPHA': 0.4657382528339075, 'CHAMPIONS_MULT': 2.0884346478565607, 'INTL_WIN_MULT': 1.1151065703104512, 'ROSTER_PERSISTENCE': 0.8124371552849343, 'MARGIN_FN': 'sqrt'}. Best is trial 53 with value: 0.2278953728561134.
[I 2026-05-19 14:17:50,439] Trial 69 finished with value: 0.22826449274936564 and parameters: {'HALF_LIFE_WEEKS': 5.520806976051847, 'SHRINK_K': 6.93689069901383, 'CN_PRIOR': -5.625065425270179, 'CN_INTL_K': 32.54567987961499, 'CN_INDIRECT_WEIGHT': 0.2884806005850496, 'REGION_SPILLOVER_ALPHA': 0.5280708613479996, 'CHAMPIONS_MULT': 1.5595149637462002, 'INTL_WIN_MULT': 1.054130182993157, 'ROSTER_PERSISTENCE': 0.747665124985024, 'MARGIN_FN': 'sqrt'}. Best is trial 53 with value: 0.2278953728561134.
[I 2026-05-19 14:17:53,735] Trial 70 finished with value: 0.22824919009859077 and parameters: {'HALF_LIFE_WEEKS': 5.320212852244807, 'SHRINK_K': 5.33197101011229, 'CN_PRIOR': -5.462675538716148, 'CN_INTL_K': 37.458382682689205, 'CN_INDIRECT_WEIGHT': 0.1888120223746318, 'REGION_SPILLOVER_ALPHA': 0.7096916903816487, 'CHAMPIONS_MULT': 1.732728837017311, 'INTL_WIN_MULT': 1.372245752362543, 'ROSTER_PERSISTENCE': 0.7216372978234268, 'MARGIN_FN': 'sqrt'}. Best is trial 53 with value: 0.2278953728561134.
[I 2026-05-19 14:17:57,106] Trial 71 finished with value: 0.228280267133062 and parameters: {'HALF_LIFE_WEEKS': 5.447237701984648, 'SHRINK_K': 7.40389264089816, 'CN_PRIOR': -5.8310459533794, 'CN_INTL_K': 44.80431430764687, 'CN_INDIRECT_WEIGHT': 0.2717423082528202, 'REGION_SPILLOVER_ALPHA': 0.5522583821487675, 'CHAMPIONS_MULT': 1.84357948065899, 'INTL_WIN_MULT': 1.310146965377014, 'ROSTER_PERSISTENCE': 0.6922101283090155, 'MARGIN_FN': 'sqrt'}. Best is trial 53 with value: 0.2278953728561134.
[I 2026-05-19 14:18:01,298] Trial 72 finished with value: 0.22827212083822457 and parameters: {'HALF_LIFE_WEEKS': 4.964777777569896, 'SHRINK_K': 7.686617292523167, 'CN_PRIOR': -5.8125626788029505, 'CN_INTL_K': 43.553362575925206, 'CN_INDIRECT_WEIGHT': 0.21835873883144943, 'REGION_SPILLOVER_ALPHA': 0.4992597180134347, 'CHAMPIONS_MULT': 1.8479907256214814, 'INTL_WIN_MULT': 1.4307100884626587, 'ROSTER_PERSISTENCE': 0.7560706678396669, 'MARGIN_FN': 'sqrt'}. Best is trial 53 with value: 0.2278953728561134.
[I 2026-05-19 14:18:04,664] Trial 73 finished with value: 0.23814157222849242 and parameters: {'HALF_LIFE_WEEKS': 5.185416175777918, 'SHRINK_K': 8.32743244188768, 'CN_PRIOR': -5.104622941543595, 'CN_INTL_K': 39.002408984414174, 'CN_INDIRECT_WEIGHT': 0.2557103057394437, 'REGION_SPILLOVER_ALPHA': 0.3963609429323974, 'CHAMPIONS_MULT': 1.9574920384047834, 'INTL_WIN_MULT': 1.3400825481504126, 'ROSTER_PERSISTENCE': 0.8627065008193441, 'MARGIN_FN': 'sqrt'}. Best is trial 53 with value: 0.2278953728561134.
[I 2026-05-19 14:18:08,177] Trial 74 finished with value: 0.22879341308856393 and parameters: {'HALF_LIFE_WEEKS': 4.552505431778776, 'SHRINK_K': 9.287435666862851, 'CN_PRIOR': -5.631128003956457, 'CN_INTL_K': 41.38266558442875, 'CN_INDIRECT_WEIGHT': 0.2982557971776908, 'REGION_SPILLOVER_ALPHA': 0.5316849303388138, 'CHAMPIONS_MULT': 1.5925207371505508, 'INTL_WIN_MULT': 1.2852242049829659, 'ROSTER_PERSISTENCE': 0.7261267416988639, 'MARGIN_FN': 'sqrt'}. Best is trial 53 with value: 0.2278953728561134.
[I 2026-05-19 14:18:11,585] Trial 75 finished with value: 0.22819969158204984 and parameters: {'HALF_LIFE_WEEKS': 5.606660460448285, 'SHRINK_K': 6.558693268919076, 'CN_PRIOR': -5.8052678874378145, 'CN_INTL_K': 34.64182088619819, 'CN_INDIRECT_WEIGHT': 0.2730088172856825, 'REGION_SPILLOVER_ALPHA': 0.59255006271108, 'CHAMPIONS_MULT': 1.819540165366123, 'INTL_WIN_MULT': 1.0382696049834002, 'ROSTER_PERSISTENCE': 0.7987849730293968, 'MARGIN_FN': 'sqrt'}. Best is trial 53 with value: 0.2278953728561134.
[I 2026-05-19 14:18:14,937] Trial 76 finished with value: 0.23605834090639224 and parameters: {'HALF_LIFE_WEEKS': 6.02256221274677, 'SHRINK_K': 7.0596450112859666, 'CN_PRIOR': -5.507806893004877, 'CN_INTL_K': 42.677774665127586, 'CN_INDIRECT_WEIGHT': 0.24545540401443217, 'REGION_SPILLOVER_ALPHA': 0.454126328785026, 'CHAMPIONS_MULT': 1.907015411747318, 'INTL_WIN_MULT': 1.1797666772756148, 'ROSTER_PERSISTENCE': 0.7012022662607368, 'MARGIN_FN': 'capped_linear_8'}. Best is trial 53 with value: 0.2278953728561134.
[I 2026-05-19 14:18:18,381] Trial 77 finished with value: 0.22831451468751368 and parameters: {'HALF_LIFE_WEEKS': 5.257267121834546, 'SHRINK_K': 6.367099612447769, 'CN_PRIOR': -5.666423209928392, 'CN_INTL_K': 48.89296648252902, 'CN_INDIRECT_WEIGHT': 0.32733977691682303, 'REGION_SPILLOVER_ALPHA': 0.506606309135223, 'CHAMPIONS_MULT': 1.692359462178755, 'INTL_WIN_MULT': 1.0840941063947385, 'ROSTER_PERSISTENCE': 0.7430181282829613, 'MARGIN_FN': 'sqrt'}. Best is trial 53 with value: 0.2278953728561134.
[I 2026-05-19 14:18:21,715] Trial 78 finished with value: 0.2398291927511436 and parameters: {'HALF_LIFE_WEEKS': 5.638565952540971, 'SHRINK_K': 8.003741185458697, 'CN_PRIOR': -5.871727664079165, 'CN_INTL_K': 33.22294742006932, 'CN_INDIRECT_WEIGHT': 0.1469029837619758, 'REGION_SPILLOVER_ALPHA': 0.5880192957106255, 'CHAMPIONS_MULT': 2.1880199483733827, 'INTL_WIN_MULT': 1.1411014261499646, 'ROSTER_PERSISTENCE': 0.6708992893045498, 'MARGIN_FN': 'log1p'}. Best is trial 53 with value: 0.2278953728561134.
[I 2026-05-19 14:18:25,165] Trial 79 finished with value: 0.23028306020162978 and parameters: {'HALF_LIFE_WEEKS': 4.093141000218128, 'SHRINK_K': 8.64623548613607, 'CN_PRIOR': -5.355887434591644, 'CN_INTL_K': 31.002325945972736, 'CN_INDIRECT_WEIGHT': 0.2987691124423204, 'REGION_SPILLOVER_ALPHA': 0.46833121010167367, 'CHAMPIONS_MULT': 1.7867168181360955, 'INTL_WIN_MULT': 1.1108302999742237, 'ROSTER_PERSISTENCE': 0.6435250483444567, 'MARGIN_FN': 'sqrt'}. Best is trial 53 with value: 0.2278953728561134.
[I 2026-05-19 14:18:28,478] Trial 80 finished with value: 0.23800929921719713 and parameters: {'HALF_LIFE_WEEKS': 6.258916405560815, 'SHRINK_K': 5.604370990769871, 'CN_PRIOR': -5.754005852728607, 'CN_INTL_K': 38.33143463344871, 'CN_INDIRECT_WEIGHT': 0.18566750070387752, 'REGION_SPILLOVER_ALPHA': 0.413348715141551, 'CHAMPIONS_MULT': 2.059749341770316, 'INTL_WIN_MULT': 1.3659246310282225, 'ROSTER_PERSISTENCE': 0.8992424321336467, 'MARGIN_FN': 'sqrt'}. Best is trial 53 with value: 0.2278953728561134.
[I 2026-05-19 14:18:31,798] Trial 81 finished with value: 0.2281033679683348 and parameters: {'HALF_LIFE_WEEKS': 5.489951948843593, 'SHRINK_K': 6.693684242445573, 'CN_PRIOR': -5.831300020722168, 'CN_INTL_K': 35.51822551302878, 'CN_INDIRECT_WEIGHT': 0.2813738480636855, 'REGION_SPILLOVER_ALPHA': 0.6024758763913511, 'CHAMPIONS_MULT': 1.8297134082327977, 'INTL_WIN_MULT': 1.034138754480996, 'ROSTER_PERSISTENCE': 0.7993702199173157, 'MARGIN_FN': 'sqrt'}. Best is trial 53 with value: 0.2278953728561134.
[I 2026-05-19 14:18:35,157] Trial 82 finished with value: 0.2282851785559169 and parameters: {'HALF_LIFE_WEEKS': 5.428963142651107, 'SHRINK_K': 7.180495076003247, 'CN_PRIOR': -5.582056445743662, 'CN_INTL_K': 34.82817411274416, 'CN_INDIRECT_WEIGHT': 0.27477682221662825, 'REGION_SPILLOVER_ALPHA': 0.6412647972403118, 'CHAMPIONS_MULT': 1.949838744581996, 'INTL_WIN_MULT': 1.3266386878059837, 'ROSTER_PERSISTENCE': 0.7669930950012191, 'MARGIN_FN': 'sqrt'}. Best is trial 53 with value: 0.2278953728561134.
[I 2026-05-19 14:18:38,490] Trial 83 finished with value: 0.22824022395851246 and parameters: {'HALF_LIFE_WEEKS': 5.077660227215065, 'SHRINK_K': 5.15799794333851, 'CN_PRIOR': -5.093621510576944, 'CN_INTL_K': 36.832381361848064, 'CN_INDIRECT_WEIGHT': 0.216578261153213, 'REGION_SPILLOVER_ALPHA': 0.5408912580150287, 'CHAMPIONS_MULT': 1.7240525022138582, 'INTL_WIN_MULT': 1.0625123221221595, 'ROSTER_PERSISTENCE': 0.8192262723609058, 'MARGIN_FN': 'sqrt'}. Best is trial 53 with value: 0.2278953728561134.
[I 2026-05-19 14:18:41,958] Trial 84 finished with value: 0.22820109820690537 and parameters: {'HALF_LIFE_WEEKS': 5.949764487784193, 'SHRINK_K': 6.775920019363874, 'CN_PRIOR': -5.914190196603854, 'CN_INTL_K': 43.509767221064116, 'CN_INDIRECT_WEIGHT': 0.255413455038616, 'REGION_SPILLOVER_ALPHA': 0.3659116514981626, 'CHAMPIONS_MULT': 1.5855380528350227, 'INTL_WIN_MULT': 1.2710456846135223, 'ROSTER_PERSISTENCE': 0.7946945530768511, 'MARGIN_FN': 'sqrt'}. Best is trial 53 with value: 0.2278953728561134.
[I 2026-05-19 14:18:45,291] Trial 85 finished with value: 0.22840875114146908 and parameters: {'HALF_LIFE_WEEKS': 4.861360353644923, 'SHRINK_K': 6.268947620403356, 'CN_PRIOR': -5.492032184958418, 'CN_INTL_K': 35.70764245787977, 'CN_INDIRECT_WEIGHT': 0.29976249190122084, 'REGION_SPILLOVER_ALPHA': 0.6239819348404033, 'CHAMPIONS_MULT': 1.8665592686001948, 'INTL_WIN_MULT': 1.0270435240220603, 'ROSTER_PERSISTENCE': 0.7314089006418629, 'MARGIN_FN': 'tanh4'}. Best is trial 53 with value: 0.2278953728561134.
