[I 2026-05-19 14:13:50,442] A new study created in RDB with name: expensive_sweep
/Users/benny_es1/PythonTest/artifacts/expensive_sweep.py:359: UserWarning: Fixed parameter ROSTER_PERSISTENCE with value 0.3 is out of range for distribution FloatDistribution(high=1.0, log=False, low=0.4, step=None).
  'ROSTER_PERSISTENCE': trial.suggest_float('ROSTER_PERSISTENCE', 0.4, 1.0),
[I 2026-05-19 14:13:53,904] Trial 0 finished with value: 0.23121964359581204 and parameters: {'HALF_LIFE_WEEKS': 6.0, 'SHRINK_K': 5.0, 'CN_PRIOR': -4.0, 'CN_INTL_K': 20.0, 'CN_INDIRECT_WEIGHT': 0.3, 'REGION_SPILLOVER_ALPHA': 0.5, 'CHAMPIONS_MULT': 2.0, 'INTL_WIN_MULT': 1.0, 'ROSTER_PERSISTENCE': 0.3, 'MARGIN_FN': 'sqrt'}. Best is trial 0 with value: 0.23121964359581204.
[I 2026-05-19 14:13:57,229] Trial 1 finished with value: 0.2381431385684383 and parameters: {'HALF_LIFE_WEEKS': 6.0, 'SHRINK_K': 5.0, 'CN_PRIOR': -4.0, 'CN_INTL_K': 20.0, 'CN_INDIRECT_WEIGHT': 0.3, 'REGION_SPILLOVER_ALPHA': 0.5, 'CHAMPIONS_MULT': 2.0, 'INTL_WIN_MULT': 1.0, 'ROSTER_PERSISTENCE': 0.7, 'MARGIN_FN': 'sqrt'}. Best is trial 0 with value: 0.23121964359581204.
[I 2026-05-19 14:14:00,518] Trial 2 finished with value: 0.2283650706302642 and parameters: {'HALF_LIFE_WEEKS': 5.621780831931537, 'SHRINK_K': 14.35928598332891, 'CN_PRIOR': -2.706027261848677, 'CN_INTL_K': 33.946339367881464, 'CN_INDIRECT_WEIGHT': 0.15141211628758372, 'REGION_SPILLOVER_ALPHA': 0.15599452033620265, 'CHAMPIONS_MULT': 1.116167224336399, 'INTL_WIN_MULT': 1.3929409166199482, 'ROSTER_PERSISTENCE': 0.7606690070459253, 'MARGIN_FN': 'tanh4'}. Best is trial 2 with value: 0.2283650706302642.
[I 2026-05-19 14:14:03,797] Trial 3 finished with value: 0.23846106368151412 and parameters: {'HALF_LIFE_WEEKS': 4.486373774747933, 'SHRINK_K': 4.363724573692308, 'CN_PRIOR': -5.174679705659548, 'CN_INTL_K': 22.16968971838151, 'CN_INDIRECT_WEIGHT': 0.39109168056095456, 'REGION_SPILLOVER_ALPHA': 0.43194501864211576, 'CHAMPIONS_MULT': 1.5824582803960838, 'INTL_WIN_MULT': 1.1894823157779035, 'ROSTER_PERSISTENCE': 0.4836963163912251, 'MARGIN_FN': 'capped_linear_8'}. Best is trial 2 with value: 0.2283650706302642.
[I 2026-05-19 14:14:07,057] Trial 4 finished with value: 0.2383372788316248 and parameters: {'HALF_LIFE_WEEKS': 4.397716475108518, 'SHRINK_K': 8.68504769937695, 'CN_PRIOR': -3.334134440120809, 'CN_INTL_K': 11.85801650879991, 'CN_INDIRECT_WEIGHT': 0.4449041537359349, 'REGION_SPILLOVER_ALPHA': 0.17052412368729153, 'CHAMPIONS_MULT': 1.130103185970559, 'INTL_WIN_MULT': 1.4591084298026666, 'ROSTER_PERSISTENCE': 0.9793792198447356, 'MARGIN_FN': 'sqrt'}. Best is trial 2 with value: 0.2283650706302642.
[I 2026-05-19 14:14:10,352] Trial 5 finished with value: 0.23816867645190493 and parameters: {'HALF_LIFE_WEEKS': 6.081067456177209, 'SHRINK_K': 3.586497052982125, 'CN_PRIOR': -3.771703904499284, 'CN_INTL_K': 11.375540844608736, 'CN_INDIRECT_WEIGHT': 0.6410582613512082, 'REGION_SPILLOVER_ALPHA': 0.2587799816000169, 'CHAMPIONS_MULT': 2.325044568707964, 'INTL_WIN_MULT': 0.9493688608715287, 'ROSTER_PERSISTENCE': 0.7120408127066865, 'MARGIN_FN': 'tanh4'}. Best is trial 2 with value: 0.2283650706302642.
[I 2026-05-19 14:14:13,703] Trial 6 finished with value: 0.23995613384748518 and parameters: {'HALF_LIFE_WEEKS': 9.576492590949323, 'SHRINK_K': 13.632755555559434, 'CN_PRIOR': -3.3094500953501167, 'CN_INTL_K': 46.87496940092467, 'CN_INDIRECT_WEIGHT': 0.10752012633374766, 'REGION_SPILLOVER_ALPHA': 0.1959828624191452, 'CHAMPIONS_MULT': 1.0904545778210761, 'INTL_WIN_MULT': 0.9602642646106114, 'ROSTER_PERSISTENCE': 0.6332063738136893, 'MARGIN_FN': 'log1p'}. Best is trial 2 with value: 0.2283650706302642.
[I 2026-05-19 14:14:17,057] Trial 7 finished with value: 0.23795288965891964 and parameters: {'HALF_LIFE_WEEKS': 6.798872582107739, 'SHRINK_K': 3.832014924671914, 'CN_PRIOR': -2.3901135866068213, 'CN_INTL_K': 12.982025747190832, 'CN_INDIRECT_WEIGHT': 0.6914765087903362, 'REGION_SPILLOVER_ALPHA': 0.7722447692966574, 'CHAMPIONS_MULT': 1.3974313630683448, 'INTL_WIN_MULT': 0.7044176936988819, 'ROSTER_PERSISTENCE': 0.8892768570729005, 'MARGIN_FN': 'tanh4'}. Best is trial 2 with value: 0.2283650706302642.
[I 2026-05-19 14:14:20,350] Trial 8 finished with value: 0.23818192764669943 and parameters: {'HALF_LIFE_WEEKS': 8.440659880820451, 'SHRINK_K': 14.127205999287892, 'CN_PRIOR': -1.637083001454604, 'CN_INTL_K': 38.13069634545991, 'CN_INDIRECT_WEIGHT': 0.059989029263267823, 'REGION_SPILLOVER_ALPHA': 0.03872519996118312, 'CHAMPIONS_MULT': 2.9195414918908393, 'INTL_WIN_MULT': 1.480911919886396, 'ROSTER_PERSISTENCE': 0.8146454437614488, 'MARGIN_FN': 'tanh4'}. Best is trial 2 with value: 0.2283650706302642.
[I 2026-05-19 14:14:23,642] Trial 9 finished with value: 0.2436079377959723 and parameters: {'HALF_LIFE_WEEKS': 3.1993480379798007, 'SHRINK_K': 11.063026678421227, 'CN_PRIOR': -5.256692681083123, 'CN_INTL_K': 34.651966089819894, 'CN_INDIRECT_WEIGHT': 0.18407020306260927, 'REGION_SPILLOVER_ALPHA': 0.9355618760814247, 'CHAMPIONS_MULT': 1.6280212311598001, 'INTL_WIN_MULT': 1.2933148515338495, 'ROSTER_PERSISTENCE': 0.5601946437672217, 'MARGIN_FN': 'log1p'}. Best is trial 2 with value: 0.2283650706302642.
[I 2026-05-19 14:14:26,921] Trial 10 finished with value: 0.247119196523074 and parameters: {'HALF_LIFE_WEEKS': 7.647786362304776, 'SHRINK_K': 10.963975814568348, 'CN_PRIOR': -2.4971847307413797, 'CN_INTL_K': 44.872831595853036, 'CN_INDIRECT_WEIGHT': 0.5213783719012799, 'REGION_SPILLOVER_ALPHA': 0.03358588493447223, 'CHAMPIONS_MULT': 2.5438591675203863, 'INTL_WIN_MULT': 1.3254008025285775, 'ROSTER_PERSISTENCE': 0.7906094819029568, 'MARGIN_FN': 'capped_linear_8'}. Best is trial 2 with value: 0.2283650706302642.
[I 2026-05-19 14:14:30,191] Trial 11 finished with value: 0.2411608706568741 and parameters: {'HALF_LIFE_WEEKS': 5.041651579317211, 'SHRINK_K': 6.9889433595064965, 'CN_PRIOR': -4.363907044361235, 'CN_INTL_K': 26.37977409955915, 'CN_INDIRECT_WEIGHT': 0.25295270834937567, 'REGION_SPILLOVER_ALPHA': 0.6855046081289344, 'CHAMPIONS_MULT': 1.9605573394572562, 'INTL_WIN_MULT': 0.7865938285550687, 'ROSTER_PERSISTENCE': 0.4824322523534672, 'MARGIN_FN': 'sqrt'}. Best is trial 2 with value: 0.2283650706302642.
[I 2026-05-19 14:14:33,468] Trial 12 finished with value: 0.24083049803882467 and parameters: {'HALF_LIFE_WEEKS': 5.434769867827949, 'SHRINK_K': 7.925978033750679, 'CN_PRIOR': -2.7939999337787746, 'CN_INTL_K': 30.33083865506819, 'CN_INDIRECT_WEIGHT': 0.2078439338563011, 'REGION_SPILLOVER_ALPHA': 0.3849491018344543, 'CHAMPIONS_MULT': 2.323540429234594, 'INTL_WIN_MULT': 1.1136463602169298, 'ROSTER_PERSISTENCE': 0.4065935135462629, 'MARGIN_FN': 'tanh4'}. Best is trial 2 with value: 0.2283650706302642.
[I 2026-05-19 14:14:36,740] Trial 13 finished with value: 0.23817585181060766 and parameters: {'HALF_LIFE_WEEKS': 7.257017897925705, 'SHRINK_K': 6.247880697033935, 'CN_PRIOR': -4.621900842150876, 'CN_INTL_K': 19.973415427723204, 'CN_INDIRECT_WEIGHT': 0.3088701001920647, 'REGION_SPILLOVER_ALPHA': 0.6394684662708776, 'CHAMPIONS_MULT': 1.6193718921132034, 'INTL_WIN_MULT': 1.239536144075863, 'ROSTER_PERSISTENCE': 0.6459907702856436, 'MARGIN_FN': 'sqrt'}. Best is trial 2 with value: 0.2283650706302642.
[I 2026-05-19 14:14:40,028] Trial 14 finished with value: 0.23838708751317292 and parameters: {'HALF_LIFE_WEEKS': 3.4101361462380733, 'SHRINK_K': 2.353847343085559, 'CN_PRIOR': -5.940693535285844, 'CN_INTL_K': 38.36663898151848, 'CN_INDIRECT_WEIGHT': 0.13627774185824446, 'REGION_SPILLOVER_ALPHA': 0.32219321670212697, 'CHAMPIONS_MULT': 2.898609894672164, 'INTL_WIN_MULT': 1.065430279062444, 'ROSTER_PERSISTENCE': 0.832935944429214, 'MARGIN_FN': 'tanh4'}. Best is trial 2 with value: 0.2283650706302642.
[I 2026-05-19 14:14:43,309] Trial 15 finished with value: 0.23799410485285724 and parameters: {'HALF_LIFE_WEEKS': 8.168315686320891, 'SHRINK_K': 10.52993013536989, 'CN_PRIOR': -1.511784177512663, 'CN_INTL_K': 26.43503270275846, 'CN_INDIRECT_WEIGHT': 0.35674748246904875, 'REGION_SPILLOVER_ALPHA': 0.5949463137286346, 'CHAMPIONS_MULT': 1.3361738658070668, 'INTL_WIN_MULT': 0.8580816227798383, 'ROSTER_PERSISTENCE': 0.9561057578075227, 'MARGIN_FN': 'sqrt'}. Best is trial 2 with value: 0.2283650706302642.
[I 2026-05-19 14:14:46,601] Trial 16 finished with value: 0.23989840864568351 and parameters: {'HALF_LIFE_WEEKS': 6.506338972965764, 'SHRINK_K': 14.924904511923724, 'CN_PRIOR': -3.3738862829201866, 'CN_INTL_K': 31.254800341163076, 'CN_INDIRECT_WEIGHT': 0.48947148404059215, 'REGION_SPILLOVER_ALPHA': 0.8446357599524584, 'CHAMPIONS_MULT': 1.815724004083004, 'INTL_WIN_MULT': 1.352989339069678, 'ROSTER_PERSISTENCE': 0.7311939855571987, 'MARGIN_FN': 'log1p'}. Best is trial 2 with value: 0.2283650706302642.
[I 2026-05-19 14:14:49,888] Trial 17 finished with value: 0.2361903027361359 and parameters: {'HALF_LIFE_WEEKS': 5.50971187910932, 'SHRINK_K': 9.549724565201767, 'CN_PRIOR': -2.133175190717015, 'CN_INTL_K': 16.893420972559536, 'CN_INDIRECT_WEIGHT': 0.2265968068932778, 'REGION_SPILLOVER_ALPHA': 0.11950013603975351, 'CHAMPIONS_MULT': 2.2710563692705996, 'INTL_WIN_MULT': 1.1339945671928, 'ROSTER_PERSISTENCE': 0.5841853644424543, 'MARGIN_FN': 'capped_linear_8'}. Best is trial 2 with value: 0.2283650706302642.
[I 2026-05-19 14:14:53,175] Trial 18 finished with value: 0.23815927318470653 and parameters: {'HALF_LIFE_WEEKS': 4.143387286089952, 'SHRINK_K': 12.576731136937275, 'CN_PRIOR': -3.0417386045957917, 'CN_INTL_K': 25.70506322857714, 'CN_INDIRECT_WEIGHT': 0.14807561064948063, 'REGION_SPILLOVER_ALPHA': 0.5172881815903393, 'CHAMPIONS_MULT': 2.6278552521213703, 'INTL_WIN_MULT': 1.4029016052664265, 'ROSTER_PERSISTENCE': 0.9174885395083425, 'MARGIN_FN': 'sqrt'}. Best is trial 2 with value: 0.2283650706302642.
[I 2026-05-19 14:14:56,458] Trial 19 finished with value: 0.23789420085499643 and parameters: {'HALF_LIFE_WEEKS': 9.934613553470383, 'SHRINK_K': 6.101440741193583, 'CN_PRIOR': -4.134397185457251, 'CN_INTL_K': 38.29941181500519, 'CN_INDIRECT_WEIGHT': 0.3081818007254826, 'REGION_SPILLOVER_ALPHA': 0.9974698284809731, 'CHAMPIONS_MULT': 1.3204067803540902, 'INTL_WIN_MULT': 1.0523820560820807, 'ROSTER_PERSISTENCE': 0.7540268541726244, 'MARGIN_FN': 'tanh4'}. Best is trial 2 with value: 0.2283650706302642.
[I 2026-05-19 14:14:59,751] Trial 20 finished with value: 0.24133573118337395 and parameters: {'HALF_LIFE_WEEKS': 5.051913167830428, 'SHRINK_K': 8.078183437090907, 'CN_PRIOR': -4.8253256784732965, 'CN_INTL_K': 42.76163655980719, 'CN_INDIRECT_WEIGHT': 0.056088313848012175, 'REGION_SPILLOVER_ALPHA': 0.3169904712377972, 'CHAMPIONS_MULT': 1.7639992235812976, 'INTL_WIN_MULT': 1.1927887669758057, 'ROSTER_PERSISTENCE': 0.40823611426801437, 'MARGIN_FN': 'sqrt'}. Best is trial 2 with value: 0.2283650706302642.
[I 2026-05-19 14:15:03,133] Trial 21 finished with value: 0.2365352550388297 and parameters: {'HALF_LIFE_WEEKS': 5.786090341294492, 'SHRINK_K': 9.57434445010627, 'CN_PRIOR': -2.0248253740003244, 'CN_INTL_K': 16.455487825412185, 'CN_INDIRECT_WEIGHT': 0.21270791241496353, 'REGION_SPILLOVER_ALPHA': 0.13512277353747626, 'CHAMPIONS_MULT': 2.3144676352803426, 'INTL_WIN_MULT': 0.876184458441228, 'ROSTER_PERSISTENCE': 0.5650926013894003, 'MARGIN_FN': 'capped_linear_8'}. Best is trial 2 with value: 0.2283650706302642.
[I 2026-05-19 14:15:06,462] Trial 22 finished with value: 0.2460922238281639 and parameters: {'HALF_LIFE_WEEKS': 5.177323157326415, 'SHRINK_K': 12.143731179012104, 'CN_PRIOR': -2.185747191533677, 'CN_INTL_K': 16.1903806976198, 'CN_INDIRECT_WEIGHT': 0.2592222375478488, 'REGION_SPILLOVER_ALPHA': 0.09549825923263955, 'CHAMPIONS_MULT': 2.1432838171400985, 'INTL_WIN_MULT': 1.1190423988146605, 'ROSTER_PERSISTENCE': 0.6411144031015676, 'MARGIN_FN': 'capped_linear_8'}. Best is trial 2 with value: 0.2283650706302642.
[I 2026-05-19 14:15:09,765] Trial 23 finished with value: 0.24600184285997484 and parameters: {'HALF_LIFE_WEEKS': 6.820705038611665, 'SHRINK_K': 2.3292717386257342, 'CN_PRIOR': -2.793836788227767, 'CN_INTL_K': 22.244041490029904, 'CN_INDIRECT_WEIGHT': 0.37621719669658205, 'REGION_SPILLOVER_ALPHA': 0.23840927377836182, 'CHAMPIONS_MULT': 2.665635199461544, 'INTL_WIN_MULT': 1.169610769858572, 'ROSTER_PERSISTENCE': 0.565052553997843, 'MARGIN_FN': 'capped_linear_8'}. Best is trial 2 with value: 0.2283650706302642.
[I 2026-05-19 14:15:13,160] Trial 24 finished with value: 0.23880093387293458 and parameters: {'HALF_LIFE_WEEKS': 3.9265665890597257, 'SHRINK_K': 9.716089784358502, 'CN_PRIOR': -3.599474298579898, 'CN_INTL_K': 15.873751632017417, 'CN_INDIRECT_WEIGHT': 0.2642010834445209, 'REGION_SPILLOVER_ALPHA': 0.013200855623216379, 'CHAMPIONS_MULT': 2.1128841000628458, 'INTL_WIN_MULT': 1.2604213571667926, 'ROSTER_PERSISTENCE': 0.50215788010284, 'MARGIN_FN': 'capped_linear_8'}. Best is trial 2 with value: 0.2283650706302642.
[I 2026-05-19 14:15:16,441] Trial 25 finished with value: 0.24740381660932856 and parameters: {'HALF_LIFE_WEEKS': 5.677030671150705, 'SHRINK_K': 12.503238656351062, 'CN_PRIOR': -1.9088638908376714, 'CN_INTL_K': 33.10294137477519, 'CN_INDIRECT_WEIGHT': 0.16739755460166583, 'REGION_SPILLOVER_ALPHA': 0.3158910848299882, 'CHAMPIONS_MULT': 2.5158489336922742, 'INTL_WIN_MULT': 1.4063988998749115, 'ROSTER_PERSISTENCE': 0.8710404451357483, 'MARGIN_FN': 'capped_linear_8'}. Best is trial 2 with value: 0.2283650706302642.
[I 2026-05-19 14:15:19,721] Trial 26 finished with value: 0.22890139265597262 and parameters: {'HALF_LIFE_WEEKS': 6.325894403027584, 'SHRINK_K': 5.526485409355857, 'CN_PRIOR': -2.5985060315585633, 'CN_INTL_K': 23.881443984977526, 'CN_INDIRECT_WEIGHT': 0.12150999482737224, 'REGION_SPILLOVER_ALPHA': 0.09557368018426238, 'CHAMPIONS_MULT': 1.0139278455026044, 'INTL_WIN_MULT': 1.0143549335445037, 'ROSTER_PERSISTENCE': 0.6664045460075714, 'MARGIN_FN': 'tanh4'}. Best is trial 2 with value: 0.2283650706302642.
[I 2026-05-19 14:15:23,028] Trial 27 finished with value: 0.2389644003942445 and parameters: {'HALF_LIFE_WEEKS': 6.323790442957264, 'SHRINK_K': 5.412909800439281, 'CN_PRIOR': -2.8867626668306015, 'CN_INTL_K': 24.215488569450656, 'CN_INDIRECT_WEIGHT': 0.11094904092007465, 'REGION_SPILLOVER_ALPHA': 0.4584979549012417, 'CHAMPIONS_MULT': 1.00108441210318, 'INTL_WIN_MULT': 1.0051091720360465, 'ROSTER_PERSISTENCE': 0.6623823361248429, 'MARGIN_FN': 'tanh4'}. Best is trial 2 with value: 0.2283650706302642.
[I 2026-05-19 14:15:26,311] Trial 28 finished with value: 0.23779735691240744 and parameters: {'HALF_LIFE_WEEKS': 7.592886464900261, 'SHRINK_K': 6.326829702557425, 'CN_PRIOR': -2.551003229075111, 'CN_INTL_K': 49.789680447653, 'CN_INDIRECT_WEIGHT': 0.06052697367796084, 'REGION_SPILLOVER_ALPHA': 0.24780564091336568, 'CHAMPIONS_MULT': 1.2300394772234002, 'INTL_WIN_MULT': 0.8831728459052844, 'ROSTER_PERSISTENCE': 0.7583429508009428, 'MARGIN_FN': 'tanh4'}. Best is trial 2 with value: 0.2283650706302642.
[I 2026-05-19 14:15:29,598] Trial 29 finished with value: 0.23942533076602251 and parameters: {'HALF_LIFE_WEEKS': 4.743003413087203, 'SHRINK_K': 4.931427742048334, 'CN_PRIOR': -3.8950536528438984, 'CN_INTL_K': 28.334045019391965, 'CN_INDIRECT_WEIGHT': 0.10710746914674224, 'REGION_SPILLOVER_ALPHA': 0.5154615279387262, 'CHAMPIONS_MULT': 1.490263357628831, 'INTL_WIN_MULT': 1.0289564454297635, 'ROSTER_PERSISTENCE': 0.6766040330265176, 'MARGIN_FN': 'tanh4'}. Best is trial 2 with value: 0.2283650706302642.
[I 2026-05-19 14:15:32,903] Trial 30 finished with value: 0.23032713599140509 and parameters: {'HALF_LIFE_WEEKS': 6.111393436141743, 'SHRINK_K': 7.230300142038566, 'CN_PRIOR': -4.302347991208391, 'CN_INTL_K': 19.30600865237524, 'CN_INDIRECT_WEIGHT': 0.3145973036174528, 'REGION_SPILLOVER_ALPHA': 0.078718017778555, 'CHAMPIONS_MULT': 1.1953739914529948, 'INTL_WIN_MULT': 0.9429518517257509, 'ROSTER_PERSISTENCE': 0.5227101904543097, 'MARGIN_FN': 'tanh4'}. Best is trial 2 with value: 0.2283650706302642.
[I 2026-05-19 14:15:36,194] Trial 31 finished with value: 0.23078973549596324 and parameters: {'HALF_LIFE_WEEKS': 6.097562638315876, 'SHRINK_K': 7.102825002942638, 'CN_PRIOR': -4.189656977526914, 'CN_INTL_K': 19.456903062059354, 'CN_INDIRECT_WEIGHT': 0.31327790166564246, 'REGION_SPILLOVER_ALPHA': 0.06886459053542689, 'CHAMPIONS_MULT': 1.1886735658604257, 'INTL_WIN_MULT': 0.9353362104203027, 'ROSTER_PERSISTENCE': 0.44612664643840283, 'MARGIN_FN': 'tanh4'}. Best is trial 2 with value: 0.2283650706302642.
[I 2026-05-19 14:15:39,485] Trial 32 finished with value: 0.24044961494095693 and parameters: {'HALF_LIFE_WEEKS': 6.706583602221551, 'SHRINK_K': 7.347124283063147, 'CN_PRIOR': -4.450114914648152, 'CN_INTL_K': 19.89445501575045, 'CN_INDIRECT_WEIGHT': 0.4223917214341394, 'REGION_SPILLOVER_ALPHA': 0.07230691929753104, 'CHAMPIONS_MULT': 1.2050865780140136, 'INTL_WIN_MULT': 0.9415637390154901, 'ROSTER_PERSISTENCE': 0.4297249024807086, 'MARGIN_FN': 'tanh4'}. Best is trial 2 with value: 0.2283650706302642.
[I 2026-05-19 14:15:42,784] Trial 33 finished with value: 0.23073707622482434 and parameters: {'HALF_LIFE_WEEKS': 6.123346872027403, 'SHRINK_K': 8.802393838147594, 'CN_PRIOR': -4.100635520562138, 'CN_INTL_K': 22.643547444938587, 'CN_INDIRECT_WEIGHT': 0.3165684021468949, 'REGION_SPILLOVER_ALPHA': 0.17359942316587176, 'CHAMPIONS_MULT': 1.0035875532803427, 'INTL_WIN_MULT': 0.8200532565613705, 'ROSTER_PERSISTENCE': 0.5187479143718118, 'MARGIN_FN': 'tanh4'}. Best is trial 2 with value: 0.2283650706302642.
[I 2026-05-19 14:15:46,079] Trial 34 finished with value: 0.22931533225654566 and parameters: {'HALF_LIFE_WEEKS': 7.2004225870257095, 'SHRINK_K': 8.908630843469817, 'CN_PRIOR': -4.904288385887525, 'CN_INTL_K': 22.72251481599991, 'CN_INDIRECT_WEIGHT': 0.3429673344156105, 'REGION_SPILLOVER_ALPHA': 0.18663966596717224, 'CHAMPIONS_MULT': 1.001092011168766, 'INTL_WIN_MULT': 0.8202571079948936, 'ROSTER_PERSISTENCE': 0.6061882448395653, 'MARGIN_FN': 'tanh4'}. Best is trial 2 with value: 0.2283650706302642.
[I 2026-05-19 14:15:49,379] Trial 35 finished with value: 0.22939816267060262 and parameters: {'HALF_LIFE_WEEKS': 7.180150473621554, 'SHRINK_K': 5.188585998391651, 'CN_PRIOR': -5.060320347859392, 'CN_INTL_K': 35.106113772352195, 'CN_INDIRECT_WEIGHT': 0.48380909215968126, 'REGION_SPILLOVER_ALPHA': 0.20042720062502822, 'CHAMPIONS_MULT': 1.0957633378977147, 'INTL_WIN_MULT': 0.7529215435585714, 'ROSTER_PERSISTENCE': 0.6080155112597858, 'MARGIN_FN': 'tanh4'}. Best is trial 2 with value: 0.2283650706302642.
[I 2026-05-19 14:15:52,670] Trial 36 finished with value: 0.2388836971536744 and parameters: {'HALF_LIFE_WEEKS': 8.41105325184011, 'SHRINK_K': 3.1522980550334383, 'CN_PRIOR': -5.538415672808828, 'CN_INTL_K': 33.92842022678559, 'CN_INDIRECT_WEIGHT': 0.558808918631444, 'REGION_SPILLOVER_ALPHA': 0.1897090263523579, 'CHAMPIONS_MULT': 1.0837217955174034, 'INTL_WIN_MULT': 0.704977624892073, 'ROSTER_PERSISTENCE': 0.6105884721105249, 'MARGIN_FN': 'tanh4'}. Best is trial 2 with value: 0.2283650706302642.
[I 2026-05-19 14:15:56,121] Trial 37 finished with value: 0.23817621695340788 and parameters: {'HALF_LIFE_WEEKS': 7.249861290077872, 'SHRINK_K': 4.868360478603568, 'CN_PRIOR': -4.883791097972849, 'CN_INTL_K': 36.3654999145339, 'CN_INDIRECT_WEIGHT': 0.5922541752435172, 'REGION_SPILLOVER_ALPHA': 0.40311085685185244, 'CHAMPIONS_MULT': 1.444190921898577, 'INTL_WIN_MULT': 0.7713345794576616, 'ROSTER_PERSISTENCE': 0.7144503109724557, 'MARGIN_FN': 'tanh4'}. Best is trial 2 with value: 0.2283650706302642.
[I 2026-05-19 14:15:59,687] Trial 38 finished with value: 0.23803383222728355 and parameters: {'HALF_LIFE_WEEKS': 8.778380077121941, 'SHRINK_K': 4.013487833563733, 'CN_PRIOR': -5.589102953115543, 'CN_INTL_K': 41.777327207495645, 'CN_INDIRECT_WEIGHT': 0.46180727417021894, 'REGION_SPILLOVER_ALPHA': 0.23402611350432923, 'CHAMPIONS_MULT': 1.2691678836711704, 'INTL_WIN_MULT': 0.7270484447228125, 'ROSTER_PERSISTENCE': 0.6930859667635371, 'MARGIN_FN': 'tanh4'}. Best is trial 2 with value: 0.2283650706302642.
[I 2026-05-19 14:16:03,038] Trial 39 finished with value: 0.23107244261536858 and parameters: {'HALF_LIFE_WEEKS': 7.174232778004652, 'SHRINK_K': 3.095534104641161, 'CN_PRIOR': -4.9544881130338, 'CN_INTL_K': 27.873558530706937, 'CN_INDIRECT_WEIGHT': 0.42561527297987223, 'REGION_SPILLOVER_ALPHA': 0.1400845006926604, 'CHAMPIONS_MULT': 1.1214900395849594, 'INTL_WIN_MULT': 0.771132390268593, 'ROSTER_PERSISTENCE': 0.6051541640028297, 'MARGIN_FN': 'log1p'}. Best is trial 2 with value: 0.2283650706302642.
[I 2026-05-19 14:16:06,363] Trial 40 finished with value: 0.2380194819724084 and parameters: {'HALF_LIFE_WEEKS': 7.723019006706162, 'SHRINK_K': 5.684023556305612, 'CN_PRIOR': -3.638100356310084, 'CN_INTL_K': 31.8162614421072, 'CN_INDIRECT_WEIGHT': 0.5333435931869905, 'REGION_SPILLOVER_ALPHA': 0.2839314363419998, 'CHAMPIONS_MULT': 1.0015754890969264, 'INTL_WIN_MULT': 0.8412787748468188, 'ROSTER_PERSISTENCE': 0.7853253953356785, 'MARGIN_FN': 'tanh4'}. Best is trial 2 with value: 0.2283650706302642.
[I 2026-05-19 14:16:09,784] Trial 41 finished with value: 0.22990672333667186 and parameters: {'HALF_LIFE_WEEKS': 6.790392644840488, 'SHRINK_K': 4.804339819635392, 'CN_PRIOR': -4.507827422015783, 'CN_INTL_K': 29.331760383261845, 'CN_INDIRECT_WEIGHT': 0.3585419258011735, 'REGION_SPILLOVER_ALPHA': 0.18959899421579568, 'CHAMPIONS_MULT': 1.1035048463077035, 'INTL_WIN_MULT': 0.9081012631626857, 'ROSTER_PERSISTENCE': 0.5320929554950662, 'MARGIN_FN': 'tanh4'}. Best is trial 2 with value: 0.2283650706302642.
[I 2026-05-19 14:16:13,123] Trial 42 finished with value: 0.22904186431290857 and parameters: {'HALF_LIFE_WEEKS': 6.919843087283755, 'SHRINK_K': 4.554973679825801, 'CN_PRIOR': -5.20886959089293, 'CN_INTL_K': 28.274364379354957, 'CN_INDIRECT_WEIGHT': 0.36246061672632146, 'REGION_SPILLOVER_ALPHA': 0.18812563514871283, 'CHAMPIONS_MULT': 1.1096335640625983, 'INTL_WIN_MULT': 0.8989306068869596, 'ROSTER_PERSISTENCE': 0.612255363742603, 'MARGIN_FN': 'tanh4'}. Best is trial 2 with value: 0.2283650706302642.
