[I 2026-05-19 14:18:49,178] Trial 86 finished with value: 0.23602605302437826 and parameters: {'HALF_LIFE_WEEKS': 5.67562777516703, 'SHRINK_K': 5.574134222601963, 'CN_PRIOR': -5.674500086570016, 'CN_INTL_K': 29.107116765497672, 'CN_INDIRECT_WEIGHT': 0.1606445905949197, 'REGION_SPILLOVER_ALPHA': 0.7271899408138661, 'CHAMPIONS_MULT': 1.8026064290497998, 'INTL_WIN_MULT': 0.9822035157888253, 'ROSTER_PERSISTENCE': 0.753707745690916, 'MARGIN_FN': 'capped_linear_8'}. Best is trial 53 with value: 0.2278953728561134.
[I 2026-05-19 14:18:53,158] Trial 87 finished with value: 0.23786916417903084 and parameters: {'HALF_LIFE_WEEKS': 6.517205154711054, 'SHRINK_K': 7.384233484702108, 'CN_PRIOR': -5.793451562190189, 'CN_INTL_K': 27.178470366498512, 'CN_INDIRECT_WEIGHT': 0.3297666964935311, 'REGION_SPILLOVER_ALPHA': 0.4552096354049293, 'CHAMPIONS_MULT': 1.7490957358643964, 'INTL_WIN_MULT': 1.131893435157575, 'ROSTER_PERSISTENCE': 0.7038711093751316, 'MARGIN_FN': 'tanh4'}. Best is trial 53 with value: 0.2278953728561134.
[I 2026-05-19 14:19:00,910] Trial 88 finished with value: 0.22867989756879392 and parameters: {'HALF_LIFE_WEEKS': 5.417644432115309, 'SHRINK_K': 7.705804523334034, 'CN_PRIOR': -5.312152952231104, 'CN_INTL_K': 40.95958573907196, 'CN_INDIRECT_WEIGHT': 0.2832884159247839, 'REGION_SPILLOVER_ALPHA': 0.49040324916976646, 'CHAMPIONS_MULT': 1.6162817925530877, 'INTL_WIN_MULT': 1.0938859529895106, 'ROSTER_PERSISTENCE': 0.6867071122807265, 'MARGIN_FN': 'sqrt'}. Best is trial 53 with value: 0.2278953728561134.
[I 2026-05-19 14:19:09,538] Trial 89 finished with value: 0.22807391586447273 and parameters: {'HALF_LIFE_WEEKS': 5.172216087101975, 'SHRINK_K': 9.027162748322105, 'CN_PRIOR': -5.9966724327052745, 'CN_INTL_K': 39.213384917842625, 'CN_INDIRECT_WEIGHT': 0.2438204469027678, 'REGION_SPILLOVER_ALPHA': 0.5699013058494171, 'CHAMPIONS_MULT': 1.5212340563420814, 'INTL_WIN_MULT': 1.1862313902549062, 'ROSTER_PERSISTENCE': 0.8350184873222943, 'MARGIN_FN': 'tanh4'}. Best is trial 53 with value: 0.2278953728561134.
[I 2026-05-19 14:19:13,735] Trial 90 finished with value: 0.22814416680736463 and parameters: {'HALF_LIFE_WEEKS': 4.664542374081823, 'SHRINK_K': 10.332472691824032, 'CN_PRIOR': -5.987716342169655, 'CN_INTL_K': 32.40709952124637, 'CN_INDIRECT_WEIGHT': 0.2454318424228001, 'REGION_SPILLOVER_ALPHA': 0.3825402986415104, 'CHAMPIONS_MULT': 1.4069291895503593, 'INTL_WIN_MULT': 1.1700595226718622, 'ROSTER_PERSISTENCE': 0.8262663293745073, 'MARGIN_FN': 'tanh4'}. Best is trial 53 with value: 0.2278953728561134.
[I 2026-05-19 14:19:17,337] Trial 91 finished with value: 0.22809757440783582 and parameters: {'HALF_LIFE_WEEKS': 5.076369832403654, 'SHRINK_K': 10.259110838632594, 'CN_PRIOR': -5.996264405271605, 'CN_INTL_K': 32.04746556657284, 'CN_INDIRECT_WEIGHT': 0.20096658691020355, 'REGION_SPILLOVER_ALPHA': 0.38732168920135485, 'CHAMPIONS_MULT': 1.4121251907003296, 'INTL_WIN_MULT': 1.1901120728857961, 'ROSTER_PERSISTENCE': 0.8609790558452103, 'MARGIN_FN': 'tanh4'}. Best is trial 53 with value: 0.2278953728561134.
[I 2026-05-19 14:19:20,947] Trial 92 finished with value: 0.22821046347250476 and parameters: {'HALF_LIFE_WEEKS': 4.288184300193754, 'SHRINK_K': 10.508322047972266, 'CN_PRIOR': -5.981412812682661, 'CN_INTL_K': 31.881628661964605, 'CN_INDIRECT_WEIGHT': 0.19737671882772234, 'REGION_SPILLOVER_ALPHA': 0.37847217280193346, 'CHAMPIONS_MULT': 1.4166530023643527, 'INTL_WIN_MULT': 1.190810163855044, 'ROSTER_PERSISTENCE': 0.8618460865715005, 'MARGIN_FN': 'tanh4'}. Best is trial 53 with value: 0.2278953728561134.
[I 2026-05-19 14:19:24,600] Trial 93 finished with value: 0.22813533383020912 and parameters: {'HALF_LIFE_WEEKS': 4.8071595919180705, 'SHRINK_K': 9.830034268535403, 'CN_PRIOR': -5.888330772594346, 'CN_INTL_K': 30.165694613386986, 'CN_INDIRECT_WEIGHT': 0.224699183150236, 'REGION_SPILLOVER_ALPHA': 0.3388446674119733, 'CHAMPIONS_MULT': 1.4467802680918362, 'INTL_WIN_MULT': 1.167759823908649, 'ROSTER_PERSISTENCE': 0.8809576878521336, 'MARGIN_FN': 'tanh4'}. Best is trial 53 with value: 0.2278953728561134.
[I 2026-05-19 14:19:28,157] Trial 94 finished with value: 0.23823900934766654 and parameters: {'HALF_LIFE_WEEKS': 4.625320520283598, 'SHRINK_K': 9.906807768743551, 'CN_PRIOR': -5.995112315704667, 'CN_INTL_K': 29.964671624369974, 'CN_INDIRECT_WEIGHT': 0.21358413781196772, 'REGION_SPILLOVER_ALPHA': 0.3511753758832197, 'CHAMPIONS_MULT': 1.3655332271437703, 'INTL_WIN_MULT': 1.161151890543678, 'ROSTER_PERSISTENCE': 0.9601566536754945, 'MARGIN_FN': 'tanh4'}. Best is trial 53 with value: 0.2278953728561134.
[I 2026-05-19 14:19:31,607] Trial 95 finished with value: 0.23817174479101155 and parameters: {'HALF_LIFE_WEEKS': 4.389937384432478, 'SHRINK_K': 10.411091492863306, 'CN_PRIOR': -5.683860294525011, 'CN_INTL_K': 32.88766294282676, 'CN_INDIRECT_WEIGHT': 0.2471833459146529, 'REGION_SPILLOVER_ALPHA': 0.2882409099316853, 'CHAMPIONS_MULT': 1.5167228906476222, 'INTL_WIN_MULT': 1.1035458374656952, 'ROSTER_PERSISTENCE': 0.9258858023006811, 'MARGIN_FN': 'tanh4'}. Best is trial 53 with value: 0.2278953728561134.
[I 2026-05-19 14:19:35,156] Trial 96 finished with value: 0.2380944944497112 and parameters: {'HALF_LIFE_WEEKS': 5.126108655398612, 'SHRINK_K': 11.150947914006517, 'CN_PRIOR': -5.886708988986432, 'CN_INTL_K': 31.011231106248605, 'CN_INDIRECT_WEIGHT': 0.23346546187446998, 'REGION_SPILLOVER_ALPHA': 0.32189392832306424, 'CHAMPIONS_MULT': 1.4559554790009723, 'INTL_WIN_MULT': 1.1779867218471838, 'ROSTER_PERSISTENCE': 0.8792856458392694, 'MARGIN_FN': 'tanh4'}. Best is trial 53 with value: 0.2278953728561134.
[I 2026-05-19 14:19:38,625] Trial 97 finished with value: 0.22812708311523494 and parameters: {'HALF_LIFE_WEEKS': 4.87184015724227, 'SHRINK_K': 10.085169185506784, 'CN_PRIOR': -5.575926635679467, 'CN_INTL_K': 38.92694976614721, 'CN_INDIRECT_WEIGHT': 0.22364365386778834, 'REGION_SPILLOVER_ALPHA': 0.40049830457594937, 'CHAMPIONS_MULT': 1.447993992404872, 'INTL_WIN_MULT': 1.230826478359607, 'ROSTER_PERSISTENCE': 0.8336248851847201, 'MARGIN_FN': 'tanh4'}. Best is trial 53 with value: 0.2278953728561134.
[I 2026-05-19 14:19:42,340] Trial 98 finished with value: 0.22813138534094948 and parameters: {'HALF_LIFE_WEEKS': 4.818793134872719, 'SHRINK_K': 10.200592044027458, 'CN_PRIOR': -5.561884290541701, 'CN_INTL_K': 25.21625794002665, 'CN_INDIRECT_WEIGHT': 0.18411944190194646, 'REGION_SPILLOVER_ALPHA': 0.38534090987213515, 'CHAMPIONS_MULT': 1.4346112015808268, 'INTL_WIN_MULT': 1.222821165879738, 'ROSTER_PERSISTENCE': 0.8328316244080395, 'MARGIN_FN': 'tanh4'}. Best is trial 53 with value: 0.2278953728561134.
[I 2026-05-19 14:19:46,361] Trial 99 finished with value: 0.2286875296668612 and parameters: {'HALF_LIFE_WEEKS': 3.676685958855818, 'SHRINK_K': 10.054613773899135, 'CN_PRIOR': -5.55479465184745, 'CN_INTL_K': 27.231990183402434, 'CN_INDIRECT_WEIGHT': 0.17508316291200185, 'REGION_SPILLOVER_ALPHA': 0.4041346080691164, 'CHAMPIONS_MULT': 1.3703131908335395, 'INTL_WIN_MULT': 1.2493163307318327, 'ROSTER_PERSISTENCE': 0.832958393779659, 'MARGIN_FN': 'tanh4'}. Best is trial 53 with value: 0.2278953728561134.
[I 2026-05-19 14:19:49,775] Trial 100 finished with value: 0.2281164935116626 and parameters: {'HALF_LIFE_WEEKS': 4.9200513459545565, 'SHRINK_K': 9.166322177361124, 'CN_PRIOR': -5.396860749079769, 'CN_INTL_K': 25.31851838728668, 'CN_INDIRECT_WEIGHT': 0.13155465482920936, 'REGION_SPILLOVER_ALPHA': 0.33494449513168445, 'CHAMPIONS_MULT': 1.4524977478196976, 'INTL_WIN_MULT': 1.2082075064155013, 'ROSTER_PERSISTENCE': 0.8529099361553816, 'MARGIN_FN': 'tanh4'}. Best is trial 53 with value: 0.2278953728561134.
[I 2026-05-19 14:19:53,220] Trial 101 finished with value: 0.22814560980371618 and parameters: {'HALF_LIFE_WEEKS': 4.73562932436901, 'SHRINK_K': 9.294707447237945, 'CN_PRIOR': -5.40365749486391, 'CN_INTL_K': 25.083563903588463, 'CN_INDIRECT_WEIGHT': 0.1626012880914897, 'REGION_SPILLOVER_ALPHA': 0.33743934227238875, 'CHAMPIONS_MULT': 1.4596066976699076, 'INTL_WIN_MULT': 1.2233293652323676, 'ROSTER_PERSISTENCE': 0.8454424823242808, 'MARGIN_FN': 'tanh4'}. Best is trial 53 with value: 0.2278953728561134.
[I 2026-05-19 14:19:56,675] Trial 102 finished with value: 0.228262999693237 and parameters: {'HALF_LIFE_WEEKS': 4.859373240236028, 'SHRINK_K': 9.123550740383212, 'CN_PRIOR': -5.451930768500843, 'CN_INTL_K': 24.77322387901953, 'CN_INDIRECT_WEIGHT': 0.12872267368920437, 'REGION_SPILLOVER_ALPHA': 0.34240768876369676, 'CHAMPIONS_MULT': 1.2833135354123517, 'INTL_WIN_MULT': 1.2038997508647697, 'ROSTER_PERSISTENCE': 0.8979437854016529, 'MARGIN_FN': 'tanh4'}. Best is trial 53 with value: 0.2278953728561134.
[I 2026-05-19 14:20:00,124] Trial 103 finished with value: 0.22815037766132462 and parameters: {'HALF_LIFE_WEEKS': 4.722169711387106, 'SHRINK_K': 9.509228759603078, 'CN_PRIOR': -5.206487793377682, 'CN_INTL_K': 24.736315588801993, 'CN_INDIRECT_WEIGHT': 0.15480429881803665, 'REGION_SPILLOVER_ALPHA': 0.3040592548183576, 'CHAMPIONS_MULT': 1.4446943555841316, 'INTL_WIN_MULT': 1.2289512006120384, 'ROSTER_PERSISTENCE': 0.8528057669811799, 'MARGIN_FN': 'tanh4'}. Best is trial 53 with value: 0.2278953728561134.
[I 2026-05-19 14:20:03,722] Trial 104 finished with value: 0.23830695544143796 and parameters: {'HALF_LIFE_WEEKS': 4.075637691493982, 'SHRINK_K': 10.169438740775892, 'CN_PRIOR': -4.71352387325036, 'CN_INTL_K': 21.35851616009606, 'CN_INDIRECT_WEIGHT': 0.08481208903267018, 'REGION_SPILLOVER_ALPHA': 0.3940471465357621, 'CHAMPIONS_MULT': 1.4784490656183897, 'INTL_WIN_MULT': 1.1936989934220152, 'ROSTER_PERSISTENCE': 0.8298979838248227, 'MARGIN_FN': 'tanh4'}. Best is trial 53 with value: 0.2278953728561134.
[I 2026-05-19 14:20:07,313] Trial 105 finished with value: 0.22824425088249592 and parameters: {'HALF_LIFE_WEEKS': 4.912580757720369, 'SHRINK_K': 10.990629171384848, 'CN_PRIOR': -5.007722585810118, 'CN_INTL_K': 20.83245937603727, 'CN_INDIRECT_WEIGHT': 0.13831770267354115, 'REGION_SPILLOVER_ALPHA': 0.3366879781709899, 'CHAMPIONS_MULT': 1.4038351140835026, 'INTL_WIN_MULT': 1.220854427218829, 'ROSTER_PERSISTENCE': 0.8829501074481713, 'MARGIN_FN': 'tanh4'}. Best is trial 53 with value: 0.2278953728561134.
[I 2026-05-19 14:20:10,693] Trial 106 finished with value: 0.2281908420407597 and parameters: {'HALF_LIFE_WEEKS': 4.305808881940076, 'SHRINK_K': 11.589696782095508, 'CN_PRIOR': -5.576670228572203, 'CN_INTL_K': 25.678042340198942, 'CN_INDIRECT_WEIGHT': 0.17636579571475414, 'REGION_SPILLOVER_ALPHA': 0.36571861065997036, 'CHAMPIONS_MULT': 1.5475809850402364, 'INTL_WIN_MULT': 1.1273222449436218, 'ROSTER_PERSISTENCE': 0.8488217249979333, 'MARGIN_FN': 'tanh4'}. Best is trial 53 with value: 0.2278953728561134.
[I 2026-05-19 14:20:14,125] Trial 107 finished with value: 0.23833920245077797 and parameters: {'HALF_LIFE_WEEKS': 4.447505016665345, 'SHRINK_K': 10.712864598015056, 'CN_PRIOR': -5.904187140268873, 'CN_INTL_K': 23.445058039427966, 'CN_INDIRECT_WEIGHT': 0.1910093705426159, 'REGION_SPILLOVER_ALPHA': 0.25882221493609864, 'CHAMPIONS_MULT': 1.3560655909649053, 'INTL_WIN_MULT': 1.2632680251805526, 'ROSTER_PERSISTENCE': 0.9242364436494356, 'MARGIN_FN': 'tanh4'}. Best is trial 53 with value: 0.2278953728561134.
[I 2026-05-19 14:20:17,460] Trial 108 finished with value: 0.2280858454604358 and parameters: {'HALF_LIFE_WEEKS': 5.1310558436887925, 'SHRINK_K': 9.068970036725734, 'CN_PRIOR': -5.4236186828523385, 'CN_INTL_K': 29.132643060996386, 'CN_INDIRECT_WEIGHT': 0.1085397300690345, 'REGION_SPILLOVER_ALPHA': 0.38718092680095206, 'CHAMPIONS_MULT': 1.2985800837475314, 'INTL_WIN_MULT': 1.1721070661527582, 'ROSTER_PERSISTENCE': 0.8273332896276896, 'MARGIN_FN': 'tanh4'}. Best is trial 53 with value: 0.2278953728561134.
[I 2026-05-19 14:20:20,882] Trial 109 finished with value: 0.23808571177682955 and parameters: {'HALF_LIFE_WEEKS': 5.173337851455211, 'SHRINK_K': 9.688973487178536, 'CN_PRIOR': -5.717686180521947, 'CN_INTL_K': 31.901894250356307, 'CN_INDIRECT_WEIGHT': 0.07705936991065837, 'REGION_SPILLOVER_ALPHA': 0.4151107474515061, 'CHAMPIONS_MULT': 1.2365994493117567, 'INTL_WIN_MULT': 1.1711981349067526, 'ROSTER_PERSISTENCE': 0.8310705405422457, 'MARGIN_FN': 'tanh4'}. Best is trial 53 with value: 0.2278953728561134.
[I 2026-05-19 14:20:24,383] Trial 110 finished with value: 0.22811566820511078 and parameters: {'HALF_LIFE_WEEKS': 5.0116656006539895, 'SHRINK_K': 10.228677057434194, 'CN_PRIOR': -5.274294640683443, 'CN_INTL_K': 29.003465359028215, 'CN_INDIRECT_WEIGHT': 0.2119606097681454, 'REGION_SPILLOVER_ALPHA': 0.3852569269641715, 'CHAMPIONS_MULT': 1.306330875196482, 'INTL_WIN_MULT': 1.1987037771005402, 'ROSTER_PERSISTENCE': 0.8147610326520232, 'MARGIN_FN': 'tanh4'}. Best is trial 53 with value: 0.2278953728561134.
[I 2026-05-19 14:20:27,802] Trial 111 finished with value: 0.228303916997282 and parameters: {'HALF_LIFE_WEEKS': 5.020271437294123, 'SHRINK_K': 8.994704775045946, 'CN_PRIOR': -5.157544811151665, 'CN_INTL_K': 29.34581814954711, 'CN_INDIRECT_WEIGHT': 0.11096696082689025, 'REGION_SPILLOVER_ALPHA': 0.3776757192794031, 'CHAMPIONS_MULT': 1.1526735323963289, 'INTL_WIN_MULT': 1.1921295039083637, 'ROSTER_PERSISTENCE': 0.8075286857537491, 'MARGIN_FN': 'tanh4'}. Best is trial 53 with value: 0.2278953728561134.
[I 2026-05-19 14:20:31,114] Trial 112 finished with value: 0.22806695380043993 and parameters: {'HALF_LIFE_WEEKS': 5.257495124031119, 'SHRINK_K': 9.861335668202939, 'CN_PRIOR': -5.34006277089676, 'CN_INTL_K': 27.246464908735753, 'CN_INDIRECT_WEIGHT': 0.22282458932718094, 'REGION_SPILLOVER_ALPHA': 0.4371394069880071, 'CHAMPIONS_MULT': 1.2979929099477183, 'INTL_WIN_MULT': 1.159390037876037, 'ROSTER_PERSISTENCE': 0.8254557907523984, 'MARGIN_FN': 'tanh4'}. Best is trial 53 with value: 0.2278953728561134.
[I 2026-05-19 14:20:34,527] Trial 113 finished with value: 0.2382000915927158 and parameters: {'HALF_LIFE_WEEKS': 5.210658737627254, 'SHRINK_K': 10.732512332658754, 'CN_PRIOR': -5.270001235026843, 'CN_INTL_K': 27.04310388723043, 'CN_INDIRECT_WEIGHT': 0.208382363147477, 'REGION_SPILLOVER_ALPHA': 0.43573875149709806, 'CHAMPIONS_MULT': 1.3056447564245788, 'INTL_WIN_MULT': 1.2076350530352609, 'ROSTER_PERSISTENCE': 0.8707706165816451, 'MARGIN_FN': 'tanh4'}. Best is trial 53 with value: 0.2278953728561134.
[I 2026-05-19 14:20:37,899] Trial 114 finished with value: 0.22835205796173502 and parameters: {'HALF_LIFE_WEEKS': 5.048171410426793, 'SHRINK_K': 10.002088412890219, 'CN_PRIOR': -5.325889214827982, 'CN_INTL_K': 28.776817161845006, 'CN_INDIRECT_WEIGHT': 0.22311183825743672, 'REGION_SPILLOVER_ALPHA': 0.3017759189465489, 'CHAMPIONS_MULT': 1.2295929050345396, 'INTL_WIN_MULT': 1.15735588843013, 'ROSTER_PERSISTENCE': 0.7859162306673392, 'MARGIN_FN': 'tanh4'}. Best is trial 53 with value: 0.2278953728561134.
[I 2026-05-19 14:20:41,242] Trial 115 finished with value: 0.228183270881073 and parameters: {'HALF_LIFE_WEEKS': 5.582958551393674, 'SHRINK_K': 8.522603509819506, 'CN_PRIOR': -4.816064079937773, 'CN_INTL_K': 26.750754468376428, 'CN_INDIRECT_WEIGHT': 0.11909014984177796, 'REGION_SPILLOVER_ALPHA': 0.4125129618884238, 'CHAMPIONS_MULT': 1.3085843230596064, 'INTL_WIN_MULT': 1.2448166213682437, 'ROSTER_PERSISTENCE': 0.859538541311673, 'MARGIN_FN': 'tanh4'}. Best is trial 53 with value: 0.2278953728561134.
[I 2026-05-19 14:20:44,825] Trial 116 finished with value: 0.22822664842729298 and parameters: {'HALF_LIFE_WEEKS': 4.817228390377245, 'SHRINK_K': 9.409060122767107, 'CN_PRIOR': -5.499059243134833, 'CN_INTL_K': 30.171121242625592, 'CN_INDIRECT_WEIGHT': 0.09845975142103092, 'REGION_SPILLOVER_ALPHA': 0.2665223956943549, 'CHAMPIONS_MULT': 1.3500357788288497, 'INTL_WIN_MULT': 1.1298889922393984, 'ROSTER_PERSISTENCE': 0.902138866531924, 'MARGIN_FN': 'tanh4'}. Best is trial 53 with value: 0.2278953728561134.
[I 2026-05-19 14:20:48,233] Trial 117 finished with value: 0.22813670143912196 and parameters: {'HALF_LIFE_WEEKS': 4.934913357528552, 'SHRINK_K': 9.843635601557406, 'CN_PRIOR': -5.613963387774663, 'CN_INTL_K': 28.269092523181243, 'CN_INDIRECT_WEIGHT': 0.14153088256170104, 'REGION_SPILLOVER_ALPHA': 0.44513552183825744, 'CHAMPIONS_MULT': 1.5045303611717216, 'INTL_WIN_MULT': 1.2312538520711098, 'ROSTER_PERSISTENCE': 0.8723993397351459, 'MARGIN_FN': 'tanh4'}. Best is trial 53 with value: 0.2278953728561134.
[I 2026-05-19 14:20:51,564] Trial 118 finished with value: 0.2280795380493978 and parameters: {'HALF_LIFE_WEEKS': 5.253385566218441, 'SHRINK_K': 8.768912809266185, 'CN_PRIOR': -5.507134556451415, 'CN_INTL_K': 39.11570664205594, 'CN_INDIRECT_WEIGHT': 0.2014695751258565, 'REGION_SPILLOVER_ALPHA': 0.3904214582447632, 'CHAMPIONS_MULT': 1.2687949470064626, 'INTL_WIN_MULT': 1.190119235940175, 'ROSTER_PERSISTENCE': 0.8178132610579842, 'MARGIN_FN': 'tanh4'}. Best is trial 53 with value: 0.2278953728561134.
[I 2026-05-19 14:20:55,770] Trial 119 finished with value: 0.22814189463255177 and parameters: {'HALF_LIFE_WEEKS': 5.310275522476303, 'SHRINK_K': 8.81550692271692, 'CN_PRIOR': -5.410462118626417, 'CN_INTL_K': 38.610365611444514, 'CN_INDIRECT_WEIGHT': 0.19769422143232632, 'REGION_SPILLOVER_ALPHA': 0.3944540976453599, 'CHAMPIONS_MULT': 1.1519229064724117, 'INTL_WIN_MULT': 1.2590044919801466, 'ROSTER_PERSISTENCE': 0.8104691259787695, 'MARGIN_FN': 'tanh4'}. Best is trial 53 with value: 0.2278953728561134.
